onet_code,emerging_title,description,core_tools,stat_text,stat_source,stat_title,stat_date,stat_url,search_query,job_search_url,fit,steps_json,experience_level
15-1254.00,AI Integration Engineer,"Builds and maintains pipelines that connect large language models and AI APIs into existing web applications and backend systems. Designs prompt workflows, manages API orchestration, and ensures reliable AI feature delivery in production environments.","LangChain, OpenAI API, Hugging Face","Job postings requiring generative AI skills grew by over 1,000% between 2022 and 2024, with AI integration and deployment roles among the fastest-growing technical positions.",LinkedIn Economic Graph,Future of Work Report: AI at Work,Jan 2024,https://economicgraph.linkedin.com/research/future-of-work-report-ai,"""AI Integration Engineer"" jobs 2025",,"Your existing skills in APIs, backend integration, and building web systems transfer directly, but you must shift from consuming APIs to orchestrating AI model behavior and managing unpredictable outputs in production.","[""Complete DeepLearning.AI's LangChain short course on Udemy"", ""Build a working chatbot using OpenAI API and LangChain in a personal project"", ""Deploy a Hugging Face model via API into an existing web app you own""]",2
15-1254.00,Context Engineer,"Architects the information environment that AI models work within — designing system prompts, retrieval pipelines, memory structures, and context windows that determine what a model sees and how it responds. Distinct from prompt engineering in that the focus is on the full context architecture, not individual prompts.","LangChain, Claude API, LlamaIndex","Researchers and practitioners are converging on ""context engineering"" as the core skill in AI product development — the discipline of precisely controlling what information models receive to produce reliable outputs.",MIT Technology Review,From vibe coding to context engineering: 2025 in software development,Nov 2025,https://www.technologyreview.com/2025/11/05/1127477/from-vibe-coding-to-context-engineering-2025-in-software-development/,"""context engineer"" OR ""context engineering"" AI jobs 2025",,"Web developers already structure information for browsers and APIs — the same instinct applies here, shifted to structuring what AI models see. The job requires understanding retrieval, token budgets, and how context shapes model behavior.","[""Complete fast.ai or DeepLearning.AI RAG course to learn retrieval-augmented generation"", ""Build a production context pipeline using LangChain and LlamaIndex with multiple data sources"", ""Read and implement the techniques from Anthropic's prompt engineering guide end-to-end""]",2
15-1254.00,AI Product Engineer,"Bridges the gap between product management and engineering by building full-stack web features powered by AI models, owning everything from UI to model selection and evaluation. Takes AI prototypes from proof-of-concept to scalable, user-facing products.","Vercel AI SDK, OpenAI API, Supabase","76% of developers expect to use or are already using AI tools in their development process, with the majority integrating them directly into their coding workflow.",Stack Overflow Developer Survey 2024,Stack Overflow Developer Survey 2024,May 2024,https://survey.stackoverflow.co/2024/ai,"""AI Product Engineer"" jobs 2025",,"Your full-stack UI and API skills transfer directly, but you must shift from displaying data to designing around unpredictable model outputs and evaluation loops.","[""Build a chatbot using Vercel AI SDK and OpenAI API with streaming responses"", ""Complete Supabase's official full-stack Next.js tutorial, adding pgvector for semantic search"", ""Ship a small public tool that lets users rate AI outputs, so you practice prompt iteration and evaluation""]",3
15-1254.00,Design Engineer,"Works at the intersection of Figma and production code, translating visual designs into polished, accessible React components and design systems. Owns the implementation layer between design and engineering: building component libraries, interaction patterns, and the pixel-level details that make products feel right.","Figma, React, Framer Motion","Figma's 2024 design-to-code report found that design-to-development handoff is the single biggest source of friction in product teams, with 60% of developers citing misaligned specs as a top time drain — the problem Design Engineers are hired to solve.",Figma,Bridging the gap between design and code,2024,https://www.figma.com/reports/bridging-design-and-code/,"""design engineer"" frontend React jobs 2025",,"Web development's HTML, CSS, and React skills carry over directly, but the job shifts from building features to perfecting the craft of UI implementation — owning component fidelity, interaction quality, and design system coherence rather than feature delivery.","[""Build and publish a React component library to npm with a Storybook docs site"", ""Learn Framer Motion: rebuild one polished animation from a site you admire"", ""Contribute to an open-source design system (shadcn/ui, Radix, MUI)""]",2
15-1251.00,AI Integration Engineer,"Designs and implements pipelines that connect large language models and AI APIs into existing enterprise software systems, ensuring reliability, security, and scalability. Day-to-day work involves prompt engineering, API orchestration, and building middleware layers between AI services and business applications.","LangChain, OpenAI API, Azure OpenAI Service","Job postings requiring generative AI skills grew by over 1,000% between 2022 and 2024, with AI integration and deployment roles among the fastest-growing technical positions.",LinkedIn Economic Graph,Future of Work Report: AI at Work,Jan 2024,https://economicgraph.linkedin.com/research/future-of-work-report-ai,"""AI Integration Engineer"" jobs 2025",,"Your coding and systems-thinking skills transfer directly, but you must shift from writing deterministic logic to orchestrating unpredictable, probabilistic AI outputs.","[""Complete DeepLearning.AI's LangChain for LLM Application Development course"", ""Build a working middleware project connecting OpenAI API to a mock enterprise database"", ""Earn the Microsoft Azure AI Engineer Associate (AI-102) certification""]",2
15-1251.00,MLOps Engineer,"Builds and maintains the infrastructure and CI/CD pipelines required to deploy, monitor, and retrain machine learning models in production environments. Responsibilities include model versioning, performance monitoring, drift detection, and automating model lifecycle management.","MLflow, Kubeflow, AWS SageMaker","MLOps Engineer was among the top 10 fastest-growing job titles on LinkedIn in 2024, with demand concentrated at companies moving from AI experimentation to production deployment at scale.",LinkedIn Economic Graph,Jobs on the Rise 2024,Jan 2024,https://business.linkedin.com/talent-solutions/resources/talent-acquisition/jobs-on-the-rise-us,"""MLOps Engineer"" jobs 2025",,"Your scripting, automation, and deployment skills transfer directly, but you must now learn to treat trained models as versioned artifacts that degrade over time and need monitoring.","[""Complete the MLflow Model Registry tutorial and track a scikit-learn model end to end"", ""Deploy a containerized model on AWS SageMaker using a free-tier account"", ""Earn the AWS Certified Machine Learning – Specialty certification""]",2
15-1251.00,Prompt Engineer,"Develops, tests, and iterates on structured prompts and prompt frameworks to optimize the performance of large language models for specific business use cases such as customer support, code generation, or content creation. Works closely with product and engineering teams to translate requirements into reliable AI behaviors.","OpenAI Playground, Anthropic Claude API, PromptFlow","Prompt engineering was among the top 5 fastest-growing job skills listed on LinkedIn in 2024, with demand concentrated at companies moving AI from experimentation to production deployment.",LinkedIn Economic Graph,Future of Work Report: AI at Work,Jan 2024,https://economicgraph.linkedin.com/research/future-of-work-report-ai,"""Prompt Engineer"" jobs 2025",,"Your debugging mindset and comfort with iterative testing carry over directly, but you must shift from writing instructions for machines to writing instructions for language models, which behave probabilistically rather than deterministically.","[""Complete DeepLearning.AI's free 'ChatGPT Prompt Engineering for Developers' course"", ""Build three working prompts in OpenAI Playground for code review, bug explanation, and test generation"", ""Publish a GitHub repo documenting your prompt experiments with version history and output comparisons""]",1
15-1251.00,AI Safety Engineer,"Evaluates and mitigates risks in AI systems including bias, hallucination, adversarial vulnerabilities, and misuse, implementing technical safeguards and red-teaming protocols before and after model deployment. Works within trust-and-safety or responsible AI teams to ensure models meet regulatory and ethical standards.","Garak, Microsoft Azure AI Content Safety, Weights & Biases","The EU AI Act, which entered into force in August 2024, mandates conformity assessments and technical safety documentation for high-risk AI systems, directly driving demand for AI safety and compliance engineering roles across organizations operating in or selling into the EU.",European Parliament,EU AI Act: first regulation on artificial intelligence,Aug 2024,https://www.europarl.europa.eu/topics/en/article/20230601STO93804/eu-ai-act-first-regulation-on-artificial-intelligence,"""AI Safety Engineer"" jobs 2025",,"Your coding skills transfer directly, but you must shift from building features to actively breaking and auditing AI systems for harm.","[""Complete DeepLearning.AI's 'Red Teaming LLMs' short course"", ""Run Garak against an open-source LLM and document findings in a public GitHub repo"", ""Earn the Microsoft Azure AI Fundamentals (AI-900) certification with focus on responsible AI modules""]",3
15-1255.00,AI UX Designer,"Designs conversational interfaces, AI-generated content workflows, and human-AI interaction patterns for products powered by large language models. Conducts user research specific to AI behavior transparency, error states, and trust-building within AI-driven experiences.","Figma, OpenAI API, Microsoft Copilot Studio","76% of UX practitioners reported that AI tools are changing their day-to-day workflow, with the ability to design AI-native interfaces emerging as the most in-demand new skill.",Nielsen Norman Group,AI & UX: How Artificial Intelligence Is Changing the Practice of User Experience,2024,https://www.nngroup.com/articles/ai-ux/,"""AI UX Designer"" jobs 2025",,"Your visual design and user research skills transfer directly, but you must shift from designing static screens to designing conversations, AI behavior, and trust-building moments.","[""Complete Google UX Design or Nielsen Norman AI UX course"", ""Build a prototype chatbot using OpenAI API and document the error states"", ""Redesign one existing app flow in Figma to include AI transparency indicators""]",2
15-1255.00,Design Engineer,"Works at the intersection of Figma and production code, translating visual designs into polished, accessible React components and design systems. Owns the implementation layer between design and engineering: building component libraries, interaction patterns, and the pixel-level details that make products feel right.","Figma, React, Framer Motion","Figma's 2024 design-to-code report found that design-to-development handoff is the single biggest source of friction in product teams, with 60% of developers citing misaligned specs as a top time drain — the problem Design Engineers are hired to solve.",Figma,Bridging the gap between design and code,2024,https://www.figma.com/reports/bridging-design-and-code/,"""Prompt Engineer"" jobs 2025",,"Interface designers already think in components and visual systems, but this role shifts from creating specs for developers to owning the implementation layer directly - building the component libraries and interaction patterns in production code.","[""Learn React and TypeScript to a working level via the official docs and small projects"", ""Build and publish a component library with Storybook documentation"", ""Contribute to an open-source design system (shadcn/ui, Radix, or MUI)""]",2
15-1255.00,Conversational UI Designer,"Designs and prototypes chat-based, voice, and multimodal interfaces for AI assistants, chatbots, and copilot features embedded in enterprise or consumer products. Defines dialogue flows, personality guidelines, and error-handling experiences to make AI interactions feel natural and on-brand.","Voiceflow, Figma, Botpress","76% of developers are already using or planning to use AI in their development process in 2024, with conversational interface design emerging as a distinct discipline as AI assistants and copilots become standard product features.",Stack Overflow,Stack Overflow Developer Survey 2024,May 2024,https://survey.stackoverflow.co/2024/ai,"""Conversational UI Designer"" OR ""Conversational UX Designer"" jobs 2025",,"Your visual layout and user flow skills transfer directly, but you must shift from designing screens to designing spoken and written conversations as the primary interface.","[""Complete Voiceflow's free Conversation Design course and build one sample chatbot"", ""Map a dialogue flow with error states and fallback messages in Figma using a conversational UI kit"", ""Earn the Google Certificate in UX Design's conversational design module or Codecademy's chatbot fundamentals course""]",2
15-1255.00,AI Product Designer,"Leads end-to-end product design for AI-native applications, defining how machine learning model outputs are surfaced, explained, and acted upon within user interfaces. Collaborates directly with data scientists and ML engineers to translate model capabilities into coherent, ethical, and usable product experiences.","Figma, Weights & Biases, Notion AI","Product design job postings requiring AI skills grew 47% year-over-year in 2024, with employers specifically seeking designers who can prototype and evaluate generative AI features.",LinkedIn Economic Graph,Future of Work Report: AI at Work,Jan 2024,https://economicgraph.linkedin.com/research/future-of-work-report-ai,"""AI Product Designer"" jobs 2025",,"Your visual and UX skills transfer directly, but you must shift from designing static interfaces to designing around uncertain, probabilistic model outputs that change over time.","[""Complete Google's AI Essentials course to build ML vocabulary"", ""Redesign an existing app's UI to surface a real API output, such as OpenAI or Google Vision, and document your design decisions"", ""Create a free Weights & Biases account and walk through a model experiment to learn how data scientists track outputs""]",3
15-1299.01,Cloud Infrastructure Automation Engineer,"Manages and optimizes cloud environments using AI-driven infrastructure-as-code tools, automating provisioning, scaling, and monitoring tasks across AWS, Azure, or GCP. Works daily with Terraform, Ansible, and AI-assisted observability platforms to reduce manual configuration and improve uptime.","Terraform, AWS CloudFormation, Datadog AI","Infrastructure-as-code adoption reached 77% of organizations in 2024, with Terraform and CloudFormation skills listed in over 40% of senior cloud engineering job postings.",Stack Overflow,Stack Overflow Developer Survey 2024,May 2024,https://survey.stackoverflow.co/2024/,"""Cloud Infrastructure Automation Engineer"" jobs 2025",,"Your hands-on server and network management experience transfers directly, but you must shift from maintaining existing systems to writing code that builds and destroys infrastructure automatically.","[""Complete HashiCorp Terraform Associate certification"", ""Deploy a personal AWS environment using Terraform and CloudFormation templates"", ""Set up a free Datadog trial and build a working monitoring dashboard for that environment""]",2
15-1299.01,AI Infrastructure Specialist,"Deploys, monitors, and maintains the server and network infrastructure that supports AI/ML workloads, including GPU clusters, model-serving endpoints, and vector databases. Ensures high availability and performance tuning for AI application pipelines in production environments.","NVIDIA NIM, Kubernetes, Prometheus","Cloud provider revenue from AI infrastructure grew over 30% year-over-year in 2024, with AWS, Azure, and GCP each launching dedicated AI infrastructure certification tracks to address talent shortages.",Amazon Web Services,AWS re:Invent 2024 State of Cloud,Dec 2024,https://aws.amazon.com/blogs/aws/reinvent-2024/,"""AI Infrastructure Specialist"" jobs 2025",,"Your server management and uptime skills transfer directly, but you must shift from general web traffic to GPU-intensive, model-serving workloads with entirely different bottlenecks.","[""Complete the Kubernetes and Cloud Native Associate (KCNA) certification"", ""Deploy a local NVIDIA NIM container and serve a small language model endpoint"", ""Build a Prometheus dashboard monitoring GPU utilization for a test ML pipeline""]",2
15-1299.01,DevSecOps Engineer,"Integrates automated security scanning, compliance checks, and AI-powered threat detection directly into CI/CD pipelines, replacing traditional manual patch management and vulnerability assessment workflows. Reviews AI-generated security findings daily and coordinates remediation with development teams.","Snyk, GitHub Advanced Security, Wiz","DevSecOps roles grew 29% in job postings between 2023 and 2024, driven by regulatory pressure and the expansion of AI-generated code that requires automated security scanning pipelines.",GitHub,GitHub Octoverse 2024,Oct 2024,https://github.blog/news-insights/octoverse/octoverse-2024/,"""DevSecOps Engineer"" jobs 2025",,"Your experience managing servers and keeping web infrastructure running translates well, but you need to shift from reactive manual fixes to writing automated security checks that run inside code deployment pipelines.","[""Earn the GitHub Actions certification and build a sample CI/CD pipeline"", ""Complete Snyk's free learning path and scan a personal GitHub repository"", ""Study for the CompTIA SecurityX (formerly CASP+) certification""]",2
15-1299.01,Platform Engineer,"Builds and maintains internal developer platforms (IDPs) that abstract away infrastructure complexity using AI-assisted tooling, enabling software teams to deploy and manage applications without deep ops knowledge. Focuses on golden paths, self-service portals, and automated environment provisioning.","Backstage, Crossplane, GitHub Copilot","Platform engineering was named a top strategic technology trend for 2024–2025 by Gartner, with 80% of large software organizations expected to establish platform engineering teams by 2026.",CNCF,CNCF Platforms White Paper,2024,https://tag-app-delivery.cncf.io/whitepapers/platforms/,"""Platform Engineer"" jobs 2025",,"Your experience managing servers and keeping web infrastructure running transfers directly, but you must shift from maintaining existing systems to building self-service platforms that let developers provision their own environments.","[""Complete the CNCF Backstage basics tutorial and build a local developer portal"", ""Earn the Kubernetes and Cloud Native Associate (KCNA) certification"", ""Build a Crossplane demo that provisions a database from a Git commit""]",3
15-1255.00,UX Researcher,"Plans and conducts user research to inform product and design decisions. Uses interviews, usability testing, surveys, and behavioral data to surface user needs, validate assumptions, and reduce design risk before and during development.","Maze, UserTesting, Dovetail, Figma","UX Researcher job postings on LinkedIn grew 38% between 2022 and 2025, with AI-native companies increasingly hiring dedicated researchers to study how users interact with AI-generated interfaces and agentic products.",Nielsen Norman Group,UX Careers Report,2024,https://www.nngroup.com/reports/ux-careers/,"""UX Researcher"" jobs 2025",,"Your design background — understanding user flows, evaluating interfaces, and communicating findings — transfers directly. The shift is from designing solutions to systematically studying the people who use them, then feeding those findings back to design and product teams.","[""Complete IDEO Us Human-Centered Design course to formalize research methodology"", ""Run 5 moderated usability tests using Maze or Lookback on an existing product"", ""Learn affinity mapping and thematic analysis: document findings from a real research project in Dovetail""]",2
41-2031.00,AI-Powered Customer Service Specialist,"Manages and optimizes AI chatbots and virtual assistants for e-commerce and retail brands, handling customer interactions, training AI models on common queries, and escalating complex issues. Uses data from customer conversations to improve AI response accuracy and customer satisfaction scores.","Intercom, Zendesk AI, OpenAI API","Over 70% of customer service organizations deployed or piloted AI-assisted support tools by end of 2024, with hybrid human-AI roles emerging as the dominant hiring model.",Salesforce,State of Service Report 2024,2024,https://www.salesforce.com/resources/research-reports/state-of-service/,"""AI Customer Service"" OR ""chatbot specialist"" retail jobs 2025",,"Your skill reading customers and solving problems transfers directly, but you'll shift from handling interactions yourself to training AI systems to handle them for you.","[""Complete Google Cloud AI Fundamentals or equivalent certification"", ""Build a test chatbot using Intercom or Zendesk AI sandbox environment"", ""Analyze 100+ customer service transcripts to identify common query patterns and AI training opportunities""]",1
41-2031.00,E-Commerce Personalization Analyst,"Uses AI recommendation engines and customer behavior analytics to optimize product suggestions, pricing strategies, and user experience for online retail platforms. Analyzes A/B test results and customer journey data to improve conversion rates.","Dynamic Yield, Segment, Google Analytics 4","Retailers using AI-driven personalization report an average 15% lift in conversion rates, fueling rapid hiring for analysts who can interpret model outputs and tune recommendation systems.",McKinsey & Company,The value of getting personalization right—or wrong—is multiplying,Nov 2021,https://www.mckinsey.com/capabilities/growth-marketing-and-sales/our-insights/the-value-of-getting-personalization-right-or-wrong-is-multiplying,"""personalization analyst"" e-commerce OR retail jobs 2024 2025",,"Your ability to read customers and suggest products transfers directly, but you'll shift from real-time sales intuition to analyzing data patterns and testing changes at scale.","[""Complete Google Analytics 4 certification and set up a test e-commerce site"", ""Build an A/B testing project using Segment to track user behavior and conversion metrics"", ""Learn Dynamic Yield or similar platform through free trial by setting up personalized product recommendations""]",1
41-2031.00,AI Product Data Specialist,"Uploads, categorizes, and enriches product catalogs for AI-driven recommendation engines and visual search tools used in e-commerce. Ensures product metadata is accurate and complete so AI systems can generate relevant personalized recommendations and descriptions.","Shopify AI, Amazon Product Ads with AI, Claude API for data validation",Demand for data labeling and AI training data roles grew over 60% in 2024 as retailers and e-commerce platforms built proprietary AI datasets to power recommendation and pricing models.,LinkedIn Economic Graph,Future of Work Report: AI at Work,Jan 2024,https://economicgraph.linkedin.com/research/future-of-work-report-ai,"""Product Data Specialist"" AI retail OR ""AI product catalog"" specialist jobs",,"You already understand what customers want and how products sell, but now you'll focus on teaching machines to understand product data instead of selling to people directly.","[""Complete a Google Cloud or AWS data fundamentals certification"", ""Build a sample product catalog project using Shopify AI or CSV data validation"", ""Learn basic Python or SQL through a structured course for data manipulation""]",1
41-3021.00,Insurance AI Risk Analyst,"Analyzes policyholder data and claims patterns using machine learning models to identify fraud, assess risk profiles, and generate predictive underwriting recommendations. Works with data science teams to implement and refine AI models that improve claims accuracy and pricing.","Python, TensorFlow, Databricks","Insurance carriers increased AI/ML investment by 40% in 2024, with risk modeling and underwriting automation driving the largest share of hiring in insurance technology roles.",WEF,Future of Jobs Report 2025,Jan 2025,https://www.weforum.org/reports/the-future-of-jobs-report-2025/,"""Insurance AI Risk Analyst"" OR ""AI Risk Analyst"" insurance jobs 2025",,"Your understanding of insurance products and risk translates directly, but you need to shift from selling policies to building mathematical models that predict risk and detect fraud automatically.","[""Complete a Python for Data Analysis course and build a portfolio project"", ""Learn SQL and machine learning basics through TensorFlow tutorials"", ""Partner with your data science team on one fraud detection model analysis""]",2
