onet_code,emerging_title,description,core_tools,stat_text,stat_source,stat_title,stat_date,stat_url,search_query,job_search_url,fit,steps_json,experience_level
41-3021.00,Insurance Customer Data Specialist,Manages and enriches customer data pipelines using AI tools to segment audiences for personalized insurance recommendations and retention campaigns. Bridges sales and data teams to ensure CRM systems are optimized with machine learning insights.,"Salesforce Einstein, HubSpot AI, dbt","Insurance companies cite AI-powered customer data tools as the top technology investment for 2024-2025, with McKinsey reporting that insurers using advanced analytics for customer segmentation see 15-20% improvement in retention rates.",McKinsey & Company,The AI opportunity in insurance,Mar 2024,https://www.mckinsey.com/industries/financial-services/our-insights/the-ai-opportunity-in-insurance,"""Customer Data Specialist"" insurance OR ""Insurance Data Specialist"" AI jobs",,"Your customer relationship skills transfer directly, but you'll shift from selling to customers to selling insights about customers by learning to work with data pipelines.","[""Complete Salesforce Einstein Analytics certification"", ""Build a customer segmentation project in dbt using real CRM data"", ""Learn SQL basics through a focused 4-week course""]",2
41-3021.00,AI-Powered Insurance Chatbot Trainer,"Trains and evaluates conversational AI models for insurance chat support and sales inquiry handling. Provides feedback loops to improve chatbot accuracy, compliance, and customer satisfaction through iterative model refinement.","OpenAI API, Rasa, Intercom","Over 60% of insurance companies deployed AI-powered virtual agents for customer service by 2024, with ongoing demand for specialists who train, evaluate, and improve these systems using real customer interaction data.",Salesforce,State of Service Report 2024,2024,https://www.salesforce.com/resources/research-reports/state-of-service/,"""Chatbot Trainer"" insurance OR ""AI Training Specialist"" insurance jobs 2024 2025",,"Your insurance knowledge stays valuable, but you'll shift from talking to customers to teaching machines how to talk to them.","[""Complete OpenAI API fundamentals course and build a test chatbot"", ""Learn Rasa framework through hands-on NLP training project"", ""Create sample insurance chatbot scripts and evaluate responses for accuracy""]",1
41-4012.00,AI Sales Operations Analyst,"Leverages AI tools to optimize sales processes, analyze pipeline data, and automate lead scoring and forecasting for wholesale/manufacturing teams. Bridges sales strategy with AI-driven insights to improve conversion rates and deal velocity.","Salesforce Einstein, HubSpot AI, Tableau","Sales operations roles requiring CRM AI skills grew 41% in job postings in 2024, as companies deploy Salesforce Einstein, HubSpot AI, and Gong to automate pipeline forecasting and rep coaching.",LinkedIn Economic Graph,Future of Work Report: AI at Work,Jan 2024,https://economicgraph.linkedin.com/research/future-of-work-report-ai,"""AI Sales Operations"" OR ""Sales Operations AI"" jobs 2025",,"Your understanding of sales pipelines and customer relationships stays valuable, but you need to shift from closing deals to building systems that help others close them faster.","[""Complete Salesforce Einstein Analytics certification"", ""Build a lead-scoring model in your current CRM using historical win/loss data"", ""Learn Tableau through a 4-week bootcamp focused on sales dashboards""]",2
41-4012.00,AI-Powered Account Manager,"Uses AI assistants and predictive analytics to manage customer relationships, identify upsell/cross-sell opportunities, and personalize outreach at scale. Focuses on retention and expansion revenue in B2B wholesale/manufacturing accounts.","ChatGPT API, Gong.io, Outreach.io","B2B sales teams using AI-assisted tools for account research and outreach reported a 35% increase in meetings booked per rep in 2024, accelerating adoption and demand for account managers who can direct AI workflows.",Salesforce,State of Sales Report 2024,2024,https://www.salesforce.com/resources/research-reports/state-of-sales/,"""Account Manager"" AI predictive analytics jobs 2025",,"Your relationship-building and deal-closing skills transfer directly, but you'll shift from manual account juggling to letting AI handle routine tasks while you focus on strategic decisions.","[""Complete ChatGPT API fundamentals course on OpenAI's platform"", ""Build a small pilot using Outreach.io to automate one customer segment's outreach"", ""Learn Gong.io call analysis to identify patterns you'd previously spot manually""]",2
41-4012.00,Prompt Engineer – Sales & Revenue Operations,"Designs and optimizes AI prompts for sales teams, creating templates for customer discovery, proposal generation, and competitive analysis. Works cross-functionally to scale AI adoption in sales workflows without technical coding.","OpenAI Playground, Claude API, Microsoft Copilot Studio","RevOps teams that deployed LLM-powered call analysis and CRM automation tools reduced manual data entry by over 60% in 2024, creating demand for prompt specialists who configure and maintain these revenue workflows.",Salesforce,State of Sales Report 2024,2024,https://www.salesforce.com/resources/research-reports/state-of-sales/,"""Prompt Engineer"" sales OR sales operations jobs 2025",,"You understand sales processes and customer needs, but now you'll teach AI systems to think like salespeople instead of executing the sales yourself.","[""Complete OpenAI Prompt Engineering for ChatGPT course"", ""Build 3 working prompt templates for discovery calls, proposals, and competitive wins"", ""Get certified in Microsoft Copilot Studio or Claude API fundamentals""]",2
41-9022.00,AI-Powered Property Valuation Specialist,"Uses machine learning models and predictive analytics platforms to generate automated property valuations, comparative market analyses, and investment potential assessments. Works with real estate data APIs and AI valuation tools to support agents and clients with data-driven pricing recommendations.","Zillow API, Redfin data feeds, TensorFlow/scikit-learn","AI-powered automated valuation models are now embedded in over 50% of US real estate transactions, with demand for specialists who can interpret, verify, and communicate model outputs to buyers and sellers.",WEF,Future of Jobs Report 2025,Jan 2025,https://www.weforum.org/reports/the-future-of-jobs-report-2025/,"""property valuation"" AI machine learning jobs 2025",,"Your market knowledge and client relationships transfer directly, but you'll need to shift from intuition-based pricing to building and validating machine learning models that make those decisions automatically.","[""Complete a Google Cloud or Coursera machine learning fundamentals certification"", ""Build a prototype valuation model using scikit-learn on public real estate datasets"", ""Integrate one live API (Zillow or Redfin) into a test project and validate predictions against actual sales""]",2
41-9022.00,Real Estate AI Content Strategist,"Develops and manages AI-generated marketing content, virtual property descriptions, and personalized buyer-agent messaging at scale using generative AI platforms. Optimizes listing presentations, email campaigns, and social media content using GPT and multimodal AI tools.","ChatGPT API, Jasper, Synthesia","Real estate teams using AI-generated content see 35% higher engagement rates and 25% faster lead conversion, driving employer demand for content-AI specialists.",National Association of Realtors,Technology in Real Estate: Buyer & Agent Preferences Survey,Oct 2024,https://www.nar.realtor/,"""AI content"" real estate strategist jobs 2024 2025",,"Your ability to understand what buyers want stays valuable, but you'll shift from writing individual descriptions to building systems that generate hundreds of personalized listings automatically.","[""Complete ChatGPT API fundamentals course on OpenAI platform"", ""Build three sample campaigns using Jasper for real estate listing variations"", ""Create one Synthesia video property tour template end-to-end""]",2
41-9022.00,Virtual Property Experience Specialist,"Creates and curates immersive 3D virtual tours, AI-enhanced property walkthroughs, and augmented reality experiences for real estate listings. Manages VR platforms, 3D modeling AI tools, and interactive property visualization software to improve remote buyer engagement.","Matterport AI, Unity, Unreal Engine Pixel Streaming","Virtual property tours now appear in 45% of real estate listings, with 70% of agents reporting they increase buyer inquiries by 20%+ within six months.",National Association of Realtors,2024 NAR Technology Adoption Study,Jun 2024,https://www.nar.realtor/research-and-statistics/research-reports,"""virtual tour"" OR ""3D property"" AI specialist jobs real estate",,"Your deep knowledge of what sells properties transfers directly, but you'll shift from showing homes to building the technology that shows them.","[""Complete Matterport certification and capture 5 properties end-to-end"", ""Learn Unity or Unreal Engine basics through a 4-week game dev course"", ""Build one AR property walkthrough prototype using available tools""]",2
41-9021.00,AI-Powered Property Valuation Specialist,"Develops and maintains machine learning models that predict property values, rental rates, and market trends using historical sales data, comparable properties, and market indicators. Works with real estate teams to implement automated valuation models (AVMs) that enhance pricing strategies and investment decisions.","TensorFlow, scikit-learn, Zillow/CoreLogic APIs","AI-powered automated valuation models (AVMs) are now used in over 50% of US mortgage originations, creating sustained demand for specialists who can audit, contextualize, and override model outputs in complex transactions.",WEF,Future of Jobs Report 2025,Jan 2025,https://www.weforum.org/reports/the-future-of-jobs-report-2025/,"""property valuation"" OR ""AVM"" ""machine learning"" jobs 2025",,"Your market knowledge and pricing instincts stay valuable, but you'll need to learn how to teach machines to find patterns instead of relying on your own judgment.","[""Complete Google's Machine Learning Crash Course or Andrew Ng's ML specialization"", ""Build a property valuation model using scikit-learn on a public real estate dataset"", ""Obtain API access to Zillow or CoreLogic and integrate live data into your model""]",3
41-9021.00,Real Estate Data Analyst (AI/ML Focus),"Analyzes large-scale property datasets using AI tools to identify market patterns, predict neighborhood trends, and generate insights for investment decisions. Creates dashboards and reports powered by machine learning to support brokers and investors in strategic planning.","Tableau, Power BI, Python (with scikit-learn or XGBoost)","PropTech investment in AI analytics platforms reached $4.2 billion globally in 2024, with data analyst roles in real estate growing 31% as brokerages and investment firms build in-house market intelligence capabilities.",WEF,Future of Jobs Report 2025,Jan 2025,https://www.weforum.org/reports/the-future-of-jobs-report-2025/,"""real estate data analyst"" machine learning AI jobs",,"Your knowledge of real estate markets transfers directly, but you'll shift from selling individual properties to building systems that predict which properties and neighborhoods will perform best.","[""Complete a Python for data analysis course (DataCamp or Coursera)"", ""Build a neighborhood trend prediction project using public housing datasets"", ""Learn Tableau or Power BI through real estate-specific dashboard tutorials""]",3
41-9021.00,AI Product Manager (PropTech),"Owns the product strategy and feature roadmap for AI-driven real estate platforms, including chatbots, valuation engines, and automated tenant screening tools. Collaborates with engineers, brokers, and customers to define requirements and prioritize AI capabilities that solve real estate workflow problems.","ChatGPT API, Stripe API, Figma prototyping","PropTech companies raised over $18 billion globally in 2024, with AI-native tools for valuation, lead generation, and transaction management driving the majority of new product investment and PM hiring.",WEF,Future of Jobs Report 2025,Jan 2025,https://www.weforum.org/reports/the-future-of-jobs-report-2025/,"""product manager"" proptech OR ""real estate technology"" AI jobs",,"Your deep knowledge of real estate workflows transfers directly, but you'll need to shift from closing deals to designing the software that helps others close them faster.","[""Complete a product management fundamentals course (Reforge or similar)"", ""Build a clickable prototype in Figma for one AI feature you'd want to see"", ""Interview 5 real estate agents about their biggest workflow pain points and document findings""]",3
41-2031.00,AI Customer Service Agent Trainer,"Trains and optimizes AI chatbots and virtual assistants used in retail customer support by providing feedback, refining conversational flows, and testing response accuracy. Works with platforms like Intercom or Zendesk to ensure AI agents handle customer inquiries effectively.","Intercom, Zendesk, OpenAI API","72% of customer service organizations plan to increase AI chatbot deployment in 2025, creating demand for trainers who can bridge human expertise and AI systems.",Statista and Customer Service Industry Reports,AI in Customer Service Adoption Trends,Jan 2025,https://www.statista.com/outlook/tmo/artificial-intelligence/customer-service,"""AI customer service"" OR ""chatbot trainer"" OR ""conversational AI trainer"" jobs 2025",,"Your customer interaction skills transfer directly, but you'll shift from solving problems yourself to teaching machines how to solve them.","[""Complete Google's AI Essentials or similar free AI fundamentals course"", ""Get hands-on with Zendesk or Intercom sandbox environments through their free training"", ""Build a portfolio project: audit and document improvements to one retail chatbot's responses""]",1
41-2031.00,E-Commerce Personalization Specialist,"Uses AI tools to analyze customer behavior and configure product recommendation engines, dynamic pricing algorithms, and personalized shopping experiences on retail websites and apps. Analyzes A/B test results and iterates on recommendation logic.","Shopify AI, Dynamic Yield, Segment","E-commerce personalization tools market is projected to exceed $11 billion by 2026, with specialist roles in personalization strategy among the fastest-growing positions at mid-size retailers.",WEF,Future of Jobs Report 2025,Jan 2025,https://www.weforum.org/reports/the-future-of-jobs-report-2025/,"""personalization specialist"" OR ""e-commerce AI"" OR ""product recommendation"" jobs retail 2025",,"Your skill reading customers and suggesting products moves online, but now you configure algorithms instead of talking to people face-to-face.","[""Complete Google Analytics certification to understand user behavior tracking"", ""Build a test project in Shopify using built-in AI recommendation features"", ""Learn A/B testing fundamentals through CXL Institute or similar course""]",1
41-2031.00,AI Prompt Engineer for Retail,"Crafts and optimizes prompts for generative AI systems used in product descriptions, marketing copy, inventory forecasting, and customer engagement in retail environments. Tests prompt variations to improve output quality and business outcomes.","ChatGPT API, Claude API, Prompt.com","Prompt engineer positions grew 35% year-over-year in 2024, with retail and e-commerce among the top hiring verticals seeking entry-level prompt specialists.",LinkedIn Hiring Report,Jobs on the Rise: AI Prompt Engineer,Jul 2024,https://www.linkedin.com/jobs/search/?keywords=prompt%20engineer,"""prompt engineer"" retail OR e-commerce OR ""generative AI"" jobs 2025",,"Your ability to understand what customers want stays valuable, but you'll need to learn how to write instructions for AI instead of talking to people directly.","[""Complete a prompt engineering course on Udemy or Maven Analytics"", ""Build a portfolio with 5 sample prompts for product descriptions using ChatGPT API"", ""Run an A/B test comparing prompt variations on real retail copy at your current job""]",1
41-3021.00,Customer Success AI Specialist,"Leverages chatbots, generative AI platforms, and customer data tools to improve policyholder onboarding, retention, and satisfaction. Monitors AI-driven customer interactions, trains models on common questions, and escalates complex cases to human agents.","ChatGPT/OpenAI API, Intercom, HubSpot","Customer success roles requiring AI tool proficiency grew 52% in postings between 2023 and 2024, as SaaS and insurtech companies use AI to scale retention programs without proportionally growing headcount.",LinkedIn Economic Graph,Future of Work Report: AI at Work,Jan 2024,https://economicgraph.linkedin.com/research/future-of-work-report-ai,"""Customer Success AI Specialist"" OR ""AI customer success"" insurance jobs",,"You understand customer needs and sales conversations, but now you'll build systems that handle those conversations automatically instead of closing deals yourself.","[""Complete OpenAI API fundamentals course on their platform"", ""Set up a test chatbot in Intercom with 5 common policy questions"", ""Build one HubSpot workflow that routes escalations to human agents""]",1
41-3021.00,Insurance Data Labeler / AI Training Specialist,"Prepares and labels insurance claim images, policy documents, and customer interactions to train machine learning models for document recognition and fraud detection. Works with annotation platforms and quality assurance tools to ensure high-quality training datasets.","Labelbox, Scale AI, AWS SageMaker Ground Truth","AI training data roles in financial services and insurance grew over 45% in 2024, driven by insurer demand to build proprietary datasets for claims fraud detection and underwriting automation.",WEF,Future of Jobs Report 2025,Jan 2025,https://www.weforum.org/reports/the-future-of-jobs-report-2025/,"""data labeler"" OR ""AI training specialist"" insurance OR ""data annotation"" insurance jobs",,"Your insurance knowledge helps you spot what matters in documents, but you'll shift from selling policies to teaching computers to recognize them.","[""Complete Labelbox or Scale AI platform certification course"", ""Build a sample annotation project labeling 500+ insurance claims"", ""Learn AWS SageMaker Ground Truth through hands-on tutorial""]",1
41-4012.00,AI-Powered Sales Operations Analyst,"Analyzes sales data using AI tools to identify pipeline trends, forecast revenue, and recommend prospect targeting strategies. Works with CRM platforms enhanced by generative AI to optimize sales processes and reduce manual data entry.","Salesforce Einstein, HubSpot AI, Tableau with AI insights","Companies using AI for sales forecasting and pipeline management report 28% higher forecast accuracy, driving rapid adoption of AI sales operations tools and specialist roles across wholesale and B2B sectors.",Salesforce,State of Sales Report 2024,2024,https://www.salesforce.com/resources/research-reports/state-of-sales/,"""AI Sales Operations Analyst"" OR ""Sales Operations AI"" jobs 2025",,"Your sales knowledge transfers directly, but you'll shift from closing deals to analyzing data that helps others close them better.","[""Complete Salesforce Einstein or HubSpot AI certification course"", ""Build a sample dashboard in Tableau analyzing real or mock sales pipeline data"", ""Lead one data-driven targeting project using AI insights at your current company""]",2
41-4012.00,AI Sales Development Representative (SDR) Trainer,"Designs and implements AI-assisted training programs for sales teams using role-play simulation platforms and conversational AI feedback tools. Develops playbooks that integrate generative AI for objection handling, negotiation tactics, and personalized outreach at scale.","ChatGPT API, Microsoft Copilot for Sales, Gong.io AI Coach","68% of sales organizations plan to invest in AI-enhanced training tools by 2025, with demand for trainers who understand both sales methodology and AI acceleration.",LinkedIn Economic Graph,2025 Workplace Learning Report: Skills Training in the AI Era,Dec 2024,https://business.linkedin.com/talent-solutions/recruiting-tips,"""Sales Development"" trainer OR ""SDR"" ""AI"" jobs 2025",,"Your understanding of sales conversations and objection handling translates directly, but you'll shift from closing deals yourself to teaching AI systems how to coach others through deals.","[""Complete Google Cloud's Generative AI fundamentals course"", ""Build a sample role-play scenario in ChatGPT API with objection branches"", ""Get certified in Gong.io's conversation intelligence platform""]",2
41-4012.00,AI Customer Intelligence Specialist,"Leverages generative AI and data analytics tools to build dynamic customer profiles, identify upsell/cross-sell opportunities, and generate personalized engagement recommendations. Translates AI-generated insights into actionable sales strategies for teams.","OpenAI API, Segment, Amplitude Analytics","Salesforce's 2024 State of Sales report found that 81% of sales teams are using or experimenting with AI, with customer intelligence and lead prioritization cited as the top use cases driving ROI.",Salesforce,"State of Sales Report, 6th Edition",Oct 2024,https://www.salesforce.com/resources/research-reports/state-of-sales/,"""Customer Intelligence"" specialist OR analyst ""AI"" jobs 2025",,"Your customer relationship skills transfer directly, but you'll move from selling to individuals toward using data tools to understand customer patterns and predict what entire groups need.","[""Complete Google Analytics or Amplitude certification course"", ""Build a sample customer segmentation project using Segment or similar data platform"", ""Learn OpenAI API basics through official tutorials and create one proof-of-concept prompt workflow""]",2
41-2031.00,AI Customer Service Specialist,"Manages and optimizes AI chatbot interactions, trains language models on customer service scenarios, and escalates complex queries while monitoring AI response quality. Works directly with customer data to improve chatbot accuracy and handles edge cases that AI systems cannot resolve.","Intercom, Zendesk with AI modules, OpenAI API","Customer service roles that combine AI tool proficiency with human judgment grew 38% in job postings between 2023 and 2024, as companies scale AI-first support without eliminating the human layer.",Salesforce,State of Service Report 2024,2024,https://www.salesforce.com/resources/research-reports/state-of-service/,"""AI Customer Service Specialist"" OR ""AI-powered customer support"" jobs 2025",,"Your ability to understand what customers need stays valuable, but you'll shift from answering questions to teaching machines how to answer them.","[""Complete Google Cloud AI Essentials or similar foundational AI course"", ""Build a portfolio project training a chatbot on 50+ real customer service scenarios"", ""Get hands-on with Zendesk and Intercom AI modules through their certification programs""]",1
41-2031.00,AI Sales Enablement Coordinator,"Leverages AI tools to analyze customer behavior patterns, prepares personalized sales scripts generated by AI, and uses predictive analytics platforms to identify high-value prospects. Coordinates between sales teams and AI systems to optimize outreach and conversion workflows.","HubSpot with AI Sales Hub, Salesforce Einstein, Copy.ai","HubSpot's 2024 State of Sales report found that sales reps using AI tools close 30% more deals and spend 2 hours less per day on administrative tasks, driving demand for coordinators who manage AI-augmented sales workflows.",HubSpot,HubSpot State of Sales 2024,Sep 2024,https://www.hubspot.com/state-of-sales,"""Sales Enablement"" AI coordinator OR ""AI sales intelligence"" entry-level jobs 2025",,"Your customer interaction skills translate directly, but you'll shift from selling to customers to selling through AI systems that identify and reach them.","[""Complete HubSpot AI Sales Hub certification course"", ""Build a sample predictive lead-scoring model using historical sales data"", ""Create 3 personalized AI sales scripts using Copy.ai for different customer segments""]",1
41-2031.00,E-Commerce AI Merchandiser,"Uses AI tools to optimize product recommendations, pricing strategies, and inventory placement on online platforms. Analyzes customer behavior data and AI-generated insights to increase conversion rates and average order value in digital storefronts.","Dynamic Yield, Klevu, Microsoft Commerce Intelligence","AI-powered merchandising tools — including dynamic pricing, visual search, and automated product tagging — were adopted by 58% of top-100 US retailers by end of 2024, creating demand for merchandisers who can operate and audit these systems.",WEF,Future of Jobs Report 2025,Jan 2025,https://www.weforum.org/reports/the-future-of-jobs-report-2025/,"""AI merchandiser"" OR ""retail merchandising AI"" e-commerce jobs",,"Your instinct for reading what customers want stays valuable, but you'll move from talking to people face-to-face to analyzing what thousands do online.","[""Complete a Google Analytics or data analytics certification course"", ""Learn Dynamic Yield or Klevu through free trials and documentation"", ""Build a small e-commerce test project analyzing customer behavior data""]",1
